{
  "schema_version": "marketing.product.v1",
  "product_id": "dhamma-quotes",
  "type": "ios_app",
  "live_status": "app_store_live",
  "destination_url": "https://apps.apple.com/us/app/daily-dhamma/id6757726663?uo=4",
  "price": {"amount": 0, "currency": "USD", "basis": "free_download_us_store"},
  "approved_claims": ["Daily Dhamma (Dhamma Quotes) offers Dhammapada verses, bookmarks and mindfulness reminders"],
  "cta": "View Daily Dhamma on the App Store",
  "conversion_events": ["app_store_impression", "install"],
  "revenue_events": ["app_store_sale", "refund"],
  "margin_rule": "report gross App Store revenue and App Store proceeds separately; unverified revenue remains unknown",
  "audiences": ["People seeking authentic Dhammapada teachings and mindfulness reminders throughout the day."],
  "metric_adapters": ["app_store_connect"],
  "primary_metric": "first_time_downloads",
  "attribution_method": "app_store_connect_app_aggregate"
}
